<?xml version="1.0" encoding="UTF-8"?>
<S-Program name="f(x) = 7 - (x+1)" xmlns:xsi="http://www.w3.org/2001/XMLSchema-instance" xsi:noNamespaceSchemaLocation="S-Emulator-v2.xsd">
	<S-Instructions>
	
		<S-Instruction type="synthetic" name="QUOTE">
			<S-Variable>y</S-Variable>
			<S-Instruction-Arguments>
				<S-Instruction-Argument name="functionName" value="Minus"/>
				<S-Instruction-Argument name="functionArguments" value="(Const7),(Successor,x1)"/>
			</S-Instruction-Arguments>
		</S-Instruction>		
		
	</S-Instructions>
	<S-Functions>
	
		<S-Function name="Successor" user-string="S">
			<S-Instructions>
			
				<S-Instruction type="synthetic" name="ASSIGNMENT">
					<S-Variable>y</S-Variable>
					<S-Instruction-Arguments>
						<S-Instruction-Argument name="assignedVariable" value="x1"/>
					</S-Instruction-Arguments>
				</S-Instruction>
				
				<S-Instruction type="basic" name="INCREASE">
					<S-Variable>y</S-Variable>
				</S-Instruction>
				
			</S-Instructions>
		</S-Function>

		<S-Function name="Const7" user-string="CONST-7">
			<S-Instructions>
			
				<S-Instruction type="synthetic" name="CONSTANT_ASSIGNMENT">
					<S-Variable>y</S-Variable>
					<S-Instruction-Arguments>
						<S-Instruction-Argument name="constantValue" value="7"/>
					</S-Instruction-Arguments>
				</S-Instruction>
				
			</S-Instructions>
		</S-Function>
		
		<S-Function name="Minus" user-string="-">		
			<S-Instructions>
			
				<S-Instruction type="synthetic" name="ASSIGNMENT">
					<S-Variable>y</S-Variable>
					<S-Instruction-Arguments>
						<S-Instruction-Argument name="assignedVariable" value="x1"></S-Instruction-Argument>
					</S-Instruction-Arguments>
				</S-Instruction>
				
				<S-Instruction type="synthetic" name="ASSIGNMENT">
					<S-Variable>z1</S-Variable>
					<S-Instruction-Arguments>
						<S-Instruction-Argument name="assignedVariable" value="x2"></S-Instruction-Argument>
					</S-Instruction-Arguments>
				</S-Instruction>
				
				<S-Instruction type="basic" name="JUMP_NOT_ZERO">
					<S-Variable>z1</S-Variable>
					<S-Label>L3</S-Label>
					<S-Instruction-Arguments>
						<S-Instruction-Argument name="JNZLabel" value="L1"/>
					</S-Instruction-Arguments>
				</S-Instruction>

				<S-Instruction type="synthetic" name="GOTO_LABEL">
					<S-Variable>z1</S-Variable>
					<S-Instruction-Arguments>
						<S-Instruction-Argument name="gotoLabel" value="EXIT"/>
					</S-Instruction-Arguments>
				</S-Instruction>

				<S-Instruction type="basic" name="JUMP_NOT_ZERO">
					<S-Variable>y</S-Variable>
					<S-Label>L1</S-Label>
					<S-Instruction-Arguments>
						<S-Instruction-Argument name="JNZLabel" value="L2"/>
					</S-Instruction-Arguments>
				</S-Instruction>

				<S-Instruction type="synthetic" name="GOTO_LABEL">
					<S-Variable>z1</S-Variable>
					<S-Instruction-Arguments>
						<S-Instruction-Argument name="gotoLabel" value="EXIT"/>
					</S-Instruction-Arguments>
				</S-Instruction>
								
				<S-Instruction type="basic" name="DECREASE">
					<S-Variable>y</S-Variable>
					<S-Label>L2</S-Label>
				</S-Instruction>

				<S-Instruction type="basic" name="DECREASE">
					<S-Variable>z1</S-Variable>
				</S-Instruction>
						
				<S-Instruction type="synthetic" name="GOTO_LABEL">
					<S-Variable>z1</S-Variable>
					<S-Instruction-Arguments>
						<S-Instruction-Argument name="gotoLabel" value="L3"/>
					</S-Instruction-Arguments>
				</S-Instruction>

			</S-Instructions>
		</S-Function>
	</S-Functions>
</S-Program>
