<?xml version="1.0" encoding="UTF-8"?>
<S-Program name="f(x)=x+3" xmlns:xsi="http://www.w3.org/2001/XMLSchema-instance" xsi:noNamespaceSchemaLocation="S-Emulator-v2.xsd">
	<S-Instructions>
		<S-Instruction type="synthetic" name="JUMP_EQUAL_FUNCTION">
			<S-Variable>x1</S-Variable>
			<S-Instruction-Arguments>
				<S-Instruction-Argument name="JEFunctionLabel" value="EXIT"/>
				<S-Instruction-Argument name="functionName" value="Const"/>
				<S-Instruction-Argument name="functionArguments" value=""/>
			</S-Instruction-Arguments>
		</S-Instruction>
		<S-Instruction type="synthetic" name="QUOTE">
			<S-Variable>z1</S-Variable>
			<S-Instruction-Arguments>
				<S-Instruction-Argument name="functionName" value="Const"/>
				<S-Instruction-Argument name="functionArguments" value=""/>
			</S-Instruction-Arguments>
		</S-Instruction>
		<S-Instruction type="synthetic" name="ASSIGNMENT">
			<S-Variable>y</S-Variable>
			<S-Instruction-Arguments>
				<S-Instruction-Argument name="assignedVariable" value="x1"/>
			</S-Instruction-Arguments>
		</S-Instruction>
		<S-Instruction type="basic" name="INCREASE">
			<S-Label>L1</S-Label>
			<S-Variable>y</S-Variable>
		</S-Instruction>
		<S-Instruction type="basic" name="DECREASE">
			<S-Variable>z1</S-Variable>
		</S-Instruction>
		<S-Instruction type="basic" name="JUMP_NOT_ZERO">
			<S-Variable>z1</S-Variable>
			<S-Instruction-Arguments>
				<S-Instruction-Argument name="JNZLabel" value="L1"/>
			</S-Instruction-Arguments>
		</S-Instruction>
	</S-Instructions>
	<S-Functions>
		<S-Function name="Const" user-string="CONST-3">
			<S-Instructions>
				<S-Instruction type="synthetic" name="CONSTANT_ASSIGNMENT">
					<S-Variable>y</S-Variable>
					<S-Instruction-Arguments>
						<S-Instruction-Argument name="constantValue" value="3"/>
					</S-Instruction-Arguments>
				</S-Instruction>
			</S-Instructions>
		</S-Function>
	</S-Functions>
</S-Program>
